{
  "schema": 1,
  "type": "EAM_LIVE_VALIDATION_REPORT",
  "purpose": "rqa-signoff",
  "matrixVersion": "2026-08-14.1",
  "status": "incomplete",
  "session": {
    "id": "EAM-RQA-FIXTURE-NOT-LIVE",
    "phase": "active",
    "reloadSequence": 0,
    "resumedAfterReload": false,
    "humanObserved": true
  },
  "environment": {
    "product": "wow_retail",
    "executionSource": "offline-mock",
    "clientChannel": "OFFLINE",
    "declaredInstallation": "offline",
    "declaredInstallationEvidence": "harness",
    "patch": "12.1.0",
    "build": "fixture",
    "interface": 120100,
    "isTestBuild": true,
    "isTestBuildKnown": true,
    "buildFlags": {
      "isPublicTestClient": true,
      "isTestBuild": true,
      "isBetaBuild": false
    },
    "source": "offline-mock",
    "channelValidation": "unconfirmed"
  },
  "automation": {
    "gameInputAutomated": false,
    "reloadUIAutomated": false,
    "playerOperated": true
  },
  "capabilities": {},
  "summary": {
    "total": 37,
    "required": 37,
    "passed": 0,
    "failed": 0,
    "blocked": 0,
    "pending": 37
  },
  "cases": [
    {
      "id": "live.environment.identity",
      "category": "environment",
      "required": true,
      "status": "pending",
      "note": ""
    },
    {
      "id": "live.tooltip.spellbook",
      "category": "tooltip",
      "required": true,
      "status": "pending",
      "note": ""
    },
    {
      "id": "live.tooltip.actionbar_macro",
      "category": "tooltip",
      "required": true,
      "status": "pending",
      "note": ""
    },
    {
      "id": "live.tooltip.bag_item",
      "category": "tooltip",
      "required": true,
      "status": "pending",
      "note": ""
    },
    {
      "id": "live.tooltip.player_aura",
      "category": "tooltip",
      "required": true,
      "status": "pending",
      "note": ""
    },
    {
      "id": "live.tooltip.target_aura",
      "category": "tooltip",
      "required": true,
      "status": "pending",
      "note": ""
    },
    {
      "id": "live.tooltip.out_of_combat",
      "category": "combat",
      "required": true,
      "status": "pending",
      "note": ""
    },
    {
      "id": "live.tooltip.in_combat_rejected",
      "category": "combat",
      "required": true,
      "status": "pending",
      "note": ""
    },
    {
      "id": "live.popup.escape_cancel",
      "category": "popup",
      "required": true,
      "status": "pending",
      "note": ""
    },
    {
      "id": "live.popup.commit_added_unchanged",
      "category": "popup",
      "required": true,
      "status": "pending",
      "note": ""
    },
    {
      "id": "live.tooltip.reload_resume",
      "category": "reload",
      "required": true,
      "status": "pending",
      "note": ""
    },
    {
      "id": "live.blizzard_input_unchanged",
      "category": "input",
      "required": true,
      "status": "pending",
      "note": ""
    },
    {
      "id": "live.popup.combat_transition",
      "category": "combat",
      "required": true,
      "status": "pending",
      "note": ""
    },
    {
      "id": "live.tooltip.generation_switch",
      "category": "tooltip",
      "required": true,
      "status": "pending",
      "note": ""
    },
    {
      "id": "live.api.load_order",
      "category": "lifecycle",
      "required": true,
      "status": "pending",
      "note": ""
    },
    {
      "id": "live.errors.none_observed",
      "category": "safety",
      "required": true,
      "status": "pending",
      "note": ""
    },
    {
      "id": "live.layout.timer_anchor_size",
      "category": "layout",
      "required": true,
      "status": "pending",
      "note": ""
    },
    {
      "id": "live.layout.applications_anchor_size",
      "category": "layout",
      "required": true,
      "status": "pending",
      "note": ""
    },
    {
      "id": "live.aura.single_countdown",
      "category": "aura",
      "required": true,
      "status": "pending",
      "note": ""
    },
    {
      "id": "live.aura.dual_countdown_diagnostic",
      "category": "aura",
      "required": true,
      "status": "pending",
      "note": ""
    },
    {
      "id": "live.cooldown.spell_countdown",
      "category": "cooldown",
      "required": true,
      "status": "pending",
      "note": ""
    },
    {
      "id": "live.cooldown.item_trigger",
      "category": "cooldown",
      "required": true,
      "status": "pending",
      "note": ""
    },
    {
      "id": "live.ground.duration_auto",
      "category": "ground",
      "required": true,
      "status": "pending",
      "note": ""
    },
    {
      "id": "live.ground.duration_manual_fallback",
      "category": "ground",
      "required": true,
      "status": "pending",
      "note": ""
    },
    {
      "id": "live.visual.swipe_alpha",
      "category": "visual",
      "required": true,
      "status": "pending",
      "note": ""
    },
    {
      "id": "live.aura.target_transition",
      "category": "aura",
      "required": true,
      "status": "pending",
      "note": ""
    },
    {
      "id": "live.aura.native_border_capability",
      "category": "aura",
      "required": true,
      "status": "pending",
      "note": ""
    },
    {
      "id": "live.aura.native_pandemic_region",
      "category": "aura",
      "required": true,
      "status": "pending",
      "note": ""
    },
    {
      "id": "live.aura.native_dispel_options",
      "category": "aura",
      "required": true,
      "status": "pending",
      "note": ""
    },
    {
      "id": "live.aura.container_disable_clear",
      "category": "aura",
      "required": true,
      "status": "pending",
      "note": ""
    },
    {
      "id": "live.unitpower.secondary_numeric",
      "category": "unitpower",
      "required": true,
      "status": "pending",
      "note": ""
    },
    {
      "id": "live.unitpower.primary_native_sink",
      "category": "unitpower",
      "required": true,
      "status": "pending",
      "note": ""
    },
    {
      "id": "live.unitpower.combat_deferred",
      "category": "unitpower",
      "required": true,
      "status": "pending",
      "note": ""
    },
    {
      "id": "live.aura.duration_zero_regression",
      "category": "aura",
      "required": true,
      "status": "pending",
      "note": ""
    },
    {
      "id": "live.aura.sound_added",
      "category": "aura",
      "required": true,
      "status": "pending",
      "note": ""
    },
    {
      "id": "live.aura.sound_applications_increased",
      "category": "aura",
      "required": true,
      "status": "pending",
      "note": ""
    },
    {
      "id": "live.aura.sound_removed",
      "category": "aura",
      "required": true,
      "status": "pending",
      "note": ""
    }
  ],
  "boundaryWarnings": [
    "offlineCannotSignoff"
  ]
}
